<?xml version="1.0" encoding="UTF-8"?>
<!DOCTYPE grieta_del_invocador SYSTEM "Projecte-T1-P1-PAO.dtd">
<grieta_del_invocador>
    <campeones>
        <campeon recurso="mana" clase="tirador">
            <nombre>Leblanc</nombre>
            <imagen url="https://leagueoflegends.fandom.com/es/wiki/LeBlanc"/>
            <descripcion>LeBlanc se desliza entre las sombras, dejando ilusiones tras de sí y confundiendo a sus enemigos.</descripcion>
            <habilidades>
                <habilidad>
                    <tipo>Pasiva</tipo>
                    <descripcion>Periódicamente, cuando LeBlanc sufre daños hasta el 40 % de su salud máxima, crea un clon de ella misma, después de lo cual ambos se vuelven instantáneamente invisibles durante 1 segundo.</descripcion>
                </habilidad>
                <habilidad>
                    <coste>70</coste>
                    <descripcion>Proyecta un sello que inflige daño mágico y marca al objetivo durante 3.5 seg.</descripcion>
                </habilidad>
                <habilidad>
                    <coste>90</coste>
                    <descripcion>LeBlanc se desplaza hacia una ubicación, infligiendo daño mágico a los enemigos cercanos.</descripcion>
                </habilidad>
                <habilidad>
                    <coste>50</coste>
                    <descripcion>Lanza una cadena que inflige daño mágico y otorga visión del enemigo alcanzado.</descripcion>
                </habilidad>
                <habilidad>
                    <tipo>Ultimate</tipo>
                    <coste>0</coste>
                    <descripcion>Copia y lanza su hechizo más reciente.</descripcion>
                </habilidad>
            </habilidades>
        </campeon>
        <campeon recurso="mana" clase="luchador">
            <nombre>Jayce</nombre>
            <imagen url="https://leagueoflegends.fandom.com/es/wiki/Jayce"/>
            <descripcion>Jayce, el Defensor del Mañana, es un inventor y guerrero que porta un martillo hextech capaz de transformarse en cañón.</descripcion>
            <habilidades>
                <habilidad>
                    <tipo>Pasiva</tipo>
                    <descripcion>Jayce comienza la partida con un punto en su definitiva, donde puede cambiar la forma de su arma: Martillo o Cañón.</descripcion>
                </habilidad>
                <habilidad>
                    <coste>40</coste>
                    <descripcion>Salta hacia un enemigo, causando daño físico a los enemigos cercanos y ralentizándolos durante 2 segundos.</descripcion>
                </habilidad>
                <habilidad>
                    <coste>50</coste>
                    <descripcion>Incrementa la velocidad de ataque durante unos segundos.</descripcion>
                </habilidad>
                <habilidad>
                    <coste>55</coste>
                    <descripcion>Empuja a un enemigo, infligiéndole daño.</descripcion>
                </habilidad>
                <habilidad>
                    <tipo>Ultimate</tipo>
                    <coste>100</coste>
                    <descripcion>Transforma su martillo en cañón o viceversa, cambiando su conjunto de habilidades.</descripcion>
                </habilidad>
            </habilidades>
        </campeon>
        <campeon recurso="mana" clase="tanque">
            <nombre>Sejuani</nombre>
            <imagen url="https://leagueoflegends.fandom.com/es/wiki/Sejuani"/>
            <descripcion>Sejuani, líder de la Garra Invernal, es una temible guerrera de Freljord que carga a la batalla montada en su jabalí.</descripcion>
            <habilidades>
                <habilidad>
                    <tipo>Pasiva</tipo>
                    <descripcion>Sejuani obtiene resistencia adicional y aplica efectos de congelación con sus ataques.</descripcion>
                </habilidad>
                <habilidad>
                    <coste>65</coste>
                    <descripcion>Sejuani carga hacia adelante, infligiendo daño a los enemigos y empujándolos.</descripcion>
                </habilidad>
                <habilidad>
                    <coste>30</coste>
                    <descripcion>Lanza un ataque de barrido con su arma, infligiendo daño en área.</descripcion>
                </habilidad>
                <habilidad>
                    <coste>30</coste>
                    <descripcion>Congela y aturde al enemigo.</descripcion>
                </habilidad>
                <habilidad>
                    <tipo>Ultimate</tipo>
                    <coste>100</coste>
                    <descripcion>Lanza una bola de hielo que aturde y daña a los enemigos.</descripcion>
                </habilidad>
            </habilidades>
        </campeon>
        <campeon recurso="mana" clase="tirador">
            <nombre>Aphelios</nombre>
            <imagen url="https://leagueoflegends.fandom.com/es/wiki/Aphelios"/>
            <descripcion>Aphelios emerge de la sombra de la luz de la luna con las armas desenvainadas...</descripcion>
            <habilidades>
                <habilidad>
                    <tipo>Pasiva</tipo>
                    <descripcion>Aphelios cuenta con cinco armas donde solo puede utilizar dos a la vez. Cada arma tiene su propio ataque básico, además de que cada arma cuenta con 50 balas de munición.</descripcion>
                </habilidad>
                <habilidad>
                    <coste>60</coste>
                    <descripcion>Dispara proyectiles adicionales de sus armas.</descripcion>
                </habilidad>
                <habilidad>
                    <coste>0</coste>
                    <descripcion>Cambia de arma.</descripcion>
                </habilidad>
                <habilidad>
                    <coste>0</coste>
                    <descripcion>Cambia de posición para mejorar sus ataques.</descripcion>
                </habilidad>
                <habilidad>
                    <tipo>Ultimate</tipo>
                    <coste>100</coste>
                    <descripcion>Realiza un ataque en área con su arma principal.</descripcion>
                </habilidad>
            </habilidades>
        </campeon>
        <campeon recurso="mana" clase="soporte">
            <nombre>Thresh</nombre>
            <imagen url="https://leagueoflegends.fandom.com/es/wiki/Thresh"/>
            <descripcion>Thresh es un espíritu torturado que encadena las almas de sus enemigos, arrastrándolos a la oscuridad.</descripcion>
            <habilidades>
                <habilidad>
                    <tipo>Pasiva</tipo>
                    <descripcion>Recoge almas de enemigos caídos para aumentar su armadura y poder de habilidad.</descripcion>
                </habilidad>
                <habilidad>
                    <coste>70</coste>
                    <descripcion>Lanza una cadena que aturde y atrae a los enemigos.</descripcion>
                </habilidad>
                <habilidad>
                    <coste>50</coste>
                    <descripcion>Crea un escudo para un aliado y lo acerca a Thresh.</descripcion>
                </habilidad>
                <habilidad>
                    <coste>50</coste>
                    <descripcion>Barre con su cadena para dañar y desplazar a los enemigos.</descripcion>
                </habilidad>
                <habilidad>
                    <tipo>Ultimate</tipo>
                    <coste>100</coste>
                    <descripcion>Crea una barrera que ralentiza y daña a los enemigos que la atraviesan.</descripcion>
                </habilidad>
            </habilidades>
        </campeon>
    </campeones>
</grieta_del_invocador>
